{
  "id": "gmds2027-full-paper",
  "title": "GMDS 2027 Full Paper Submission Timeline",
  "authors": [
    "N"
  ],
  "venue": "GMDS-Jahrestagung 2027",
  "status": "in_progress",
  "createdAt": "2026-09-03",
  "updatedAt": "2026-09-03",
  "timeline": {
    "start": "2027-01-11",
    "end": "2027-09-05"
  },
  "milestones": [
    {
      "id": "m1",
      "label": "Call for Contributions opens",
      "date": "2027-01-11",
      "type": "event",
      "note": "Submission of contributions for talks, posters and workshops opens via the conference system."
    },
    {
      "id": "m2",
      "label": "Full paper / abstract submission deadline",
      "date": "2027-03-31",
      "type": "deadline",
      "note": "Deadline for papers, abstracts and special formats is 23:59. Review is expected to take approximately 12 weeks."
    },
    {
      "id": "m3",
      "label": "Conference registration opens",
      "date": "2027-04-05",
      "type": "event"
    },
    {
      "id": "m4",
      "label": "Acceptance notification",
      "date": "2027-06-20",
      "type": "event",
      "note": "All submitters receive notification about acceptance of their contribution."
    },
    {
      "id": "m5",
      "label": "Camera-ready submission deadline",
      "date": "2027-07-11",
      "type": "deadline",
      "note": "Final submission deadline for accepted contributions."
    },
    {
      "id": "m6",
      "label": "Early-bird registration deadline",
      "date": "2027-07-18",
      "type": "deadline"
    },
    {
      "id": "m7",
      "label": "Proceedings published online",
      "date": "2027-08-30",
      "type": "event"
    },
    {
      "id": "m8",
      "label": "GMDS 2027 conference",
      "date": "2027-09-05",
      "type": "event",
      "note": "GMDS annual conference in Hannover, 5–9 September 2027."
    }
  ],
  "slots": [
    {
      "id": "s1",
      "label": "Full paper preparation",
      "start": "2027-01-11",
      "end": "2027-03-30",
      "note": "Prepare the contribution for submission through the GMDS conference system."
    },
    {
      "id": "s2",
      "label": "Review period",
      "start": "2027-04-01",
      "end": "2027-06-19",
      "note": "The GMDS page states that review is expected to take approximately 12 weeks."
    },
    {
      "id": "s3",
      "label": "Revision and camera-ready preparation",
      "start": "2027-06-20",
      "end": "2027-07-10",
      "note": "Revise the accepted contribution and prepare the final camera-ready version."
    },
    {
      "id": "s4",
      "label": "Conference preparation",
      "start": "2027-07-12",
      "end": "2027-09-04",
      "note": "Prepare for presentation and participation after camera-ready submission."
    }
  ],
  "events": [],
  "processes": [
    {
      "id": "p1",
      "label": "Preparing GMDS full paper",
      "active": true,
      "since": "2026-09-03",
      "note": "The official GMDS 2027 page describes the 31 March 2027 deadline as covering papers, abstracts and special formats."
    }
  ]
}